url;title;timestamp;writer;shares_count;comments_count;summary;sources;categories
https://www.tecmundo.com.br/cultura-geek/204441-jogador-n-1-tye-sheridan-gostaria-retornar-sequencia.htm;;;;0;0;;;
https://www.tecmundo.com.br/ciencia/204416-softbank-lanca-robo-garcom-suprir-escassez-japao.htm;SoftBank lança robô 'garçom' para suprir escassez no Japão;2020-09-28T21:00:00;Kris Gaiato;0;0;Em razão da escassez de mão de obra no Japão, a SoftBank anunciou nesta segunda-feira (28), um robô para o setor de alimentação desenvolvido pela startup parceria Bear Robotics, que tem sede nos Estados Unidos. Esta iniciativa promete ser a solução para restaurantes que estão sofrendo com as legislações restritivas implementadas durante a pandemia de covid-19.;Techcrunch,Softbank;Ciência,Invenção,Inovação,Robótica
https://www.tecmundo.com.br/voxel/204428-among-us-2-cancelado-aprimoramentos-jogo-original.htm;;;;0;0;;;
https://www.tecmundo.com.br/ciencia/204415-amazonia-aproxima-ponto-nao-se-recuperar.htm;;;;0;0;;;
https://www.tecmundo.com.br/ciencia/204440-conama-elimina-regras-protecao-ambiental-confira-mudou.htm;"Conama elimina regras de proteção ambiental; confira o que mudou";2020-09-28T20:18:08;Reinaldo  Zaruvni;0;0;Nesta segunda-feira (28), durante a 135ª reunião do Conselho Nacional do Meio Ambiente (Conama), o governo federal revogou quatro resoluções que determinavam regras de proteção ambiental e limitação de uso de recursos no Brasil – sem audiências públicas ou ter competência jurídica, de acordo com a procuradora Fátima Borghi. Entretanto, o que muda com a decisão?;Greenpeace,G1,G1,NetNature;Ciência,Meio ambiente,Governo
https://www.tecmundo.com.br/ciencia/204414-supercomputador-simular-terra-prever-desastres-naturais.htm;Supercomputador vai simular Terra para prever desastres naturais;2020-09-28T20:00:01;Kris Gaiato;0;0;A multinacional de tecnologia NEC está desenvolvendo um novo supercomputador que irá simular o planeta Terra para prever desastres naturais. O projeto conta com a parceria da Nvidia e foi uma encomenda da Agência Japonesa de Ciência e Tecnologia Marinha e Terrestre (JAMSTEC, na sigla em inglês). Essa será a 4ª geração de supercomputadores da agência com previsão de entrega para março de 2021.;Techradar;Ciência,Supercomputadores,Meio ambiente
https://www.tecmundo.com.br/minha-serie/204421-funimation-estreia-brasil-dezembro-200-animes.htm;;;;0;0;;;
https://www.tecmundo.com.br/internet/204411-evento-google-assistir-lancamento-do-pixel-5.htm;Evento do Google: como assistir ao lançamento do Pixel 5;2020-09-28T19:30:01;Adriano Camacho Vieira Júnior;0;0;"Nesta quarta-feira (30), a Google fará uma conferência virtual para anunciar suas mais novas tecnologias. No evento, chamado de Google Launch Night In (""Noite de Lançamentos da Google"", em tradução livre), a empresa deve apresentar a nova linha de celulares Pixel focada no 5G, além de outras novidades, como os novos Google Nest.";CNET,Google;Internet,Eventos,Google,Chromecast,Google Pixel 5
https://www.tecmundo.com.br/software/204407-google-meet-gratuito-tera-limite-60-minutos-partir-outubro.htm;Google Meet gratuito terá limite de 60 minutos a partir outubro;2020-09-28T19:00:00;Ramalho Lima;0;0;A partir do dia 1º de outubro, a versão gratuita do Google Meet passará a ter um limite de 60 minutos para videochamadas. O Meet é um app de videoconferências com foco no segmento corporativo, e teve uma versão gratuita lançada no início deste ano, o que foi um grande “quebra galho” para várias companhias, instituições de ensino e usuários finais nesse período de isolamento social.;Mashable;Software,Google,Apps
https://www.tecmundo.com.br/minha-serie/204408-serie-senhor-dos-aneis-amazon-prime-video-retorna-gravacoes.htm;Série O Senhor dos Anéis do Amazon Prime Video retorna às gravações;2020-09-28T19:00:00;;0;0;Não é segredo que o Amazon Prime Video está produzindo uma série de O Senhor dos Anéis. Porém, a novidade é que o seriado, que teve as filmagens suspensas em março por conta da pandemia do novo coronavírus, retomou as gravações na Nova Zelândia nesta semana.;Deadline;Minha Série,Seriados,Séries,Amazon Prime Video,Streaming
https://www.tecmundo.com.br/ciencia/204437-brasil-tera-onda-calor-historica-semana.htm;Brasil terá onda de calor histórica nesta semana;2020-09-28T18:30:42;Adriano Camacho Vieira Júnior;18;7;De acordo com o site MetSul Meteorologia, durante esta semana o Brasil enfrentará uma onda de calor recorde. Em algumas regiões do país as temperaturas poderão atingir até 45 °C, em máximas nunca registradas. Ainda de acordo com a entidade, o efeito sentido será semelhante aos fenômenos de extremo calor em algumas regiões da Califórnia (EUA) e da Austrália.;MetSul Meteorologia;Ciência,Meio ambiente,Meteorologia,Saúde
https://www.tecmundo.com.br/mercado/204406-tesla-adquirir-parte-negocio-baterias-lg.htm;Tesla pode adquirir parte do negócio de baterias da LG;2020-09-28T18:30:01;André Luiz Dias Gonçalves;0;0;A Tesla estaria pensando em adquirir parte da LG Energy Solution, subsidiária da marca sul-coreana dedicada à produção de baterias para carros elétricos e outros segmentos, que deve se tornar independente das demais operações da empresa. O rumor foi divulgado pelo The Korea Times, nesta segunda-feira (28).;The Korea Times,Electrek,Teslarati;Mercado,Tesla,LG
https://www.tecmundo.com.br/voxel/204430-call-of-duty-black-ops-cold-war-zombies-revelado-quarta.htm;;;;0;0;;;
https://www.tecmundo.com.br/cultura-geek/204431-vampiros-vs-the-bronx-confira-trailer-novo-filme-netflix.htm;Vampiros Vs the Bronx: confira o trailer do novo filme da Netflix;2020-09-28T18:14:32;Robinson Samulak Alves;0;0;A Netflix divulgou hoje (28) o trailer de Vampiros vs the Bronx, seu novo filme que irá acompanhar uma guerra entre adolescentes e vampiros. No vídeo, um grupo de garotos do Bronx descobre que o bairro está sendo invadido por vampiros e decidem se unir para caçá-los, antes que eles se tornem a presa. Confira o vídeo abaixo.;YouTube;Cultura Geek,Filmes,Netflix,Streaming
https://www.tecmundo.com.br/software/204395-roku-channel-ganha-app-videos-gratuitos-android-ios.htm;Roku Channel ganha app com vídeos gratuitos para Android e iOS;2020-09-28T18:00:01;Jorge Marin;7;0;Quem curte vídeos gratuitos provavelmente já ouviu falar do Roku Channel, que oferece esse tipo de conteúdo para quem utilizam a sua set-top box e as smartTVs da AOC onde a plataforma vem embutida. Agora, segundo informado pelo site Engadget nesta segunda-feira (28), o Roku Channel pode ser baixado como um app autônomo para Android e iOS.;Engadget;Software,Apps,Entretenimento
https://www.tecmundo.com.br/voxel/204429-mhw-iceborne-ganha-novo-trailer-fatalis-velkhana-arquiaguerrida.htm;MHW: Iceborne ganha novo trailer com Fatalis e Velkhana Arquiaguerrida;2020-09-28T18:00:01;André Luis Dias Custodio;0;0;A Capcom disponibilizou um novo trailer revelando mais detalhes sobre a última atualização gratuita prevista para Monster Hunter World: Iceborne. Apresentando os impiedosos dragões Fatalis e Velkhana, o Title Update 5 também irá acrescentar diversos eventos, quests e itens de customização, com destaque para as skins temáticas de Halloween.;Push Square;Voxel,Console,PS4,Xbox One,Plataformas,PC
https://www.tecmundo.com.br/mobilidade-urbana-smart-cities/204399-empresa-consegue-montar-casas-24-horas-impressao-3d.htm;Empresa consegue montar casas em 24 horas com impressão 3D;2020-09-28T17:30:01;Mateus Mognon;0;0;A empresa estadunidense Mighty Buildings, que atua na Califórnia, está ganhando destaque no mercado de construção civil com um modelo de negócio ousado: vender casas impressas em 3D que ficam prontas em 24 horas. O procedimento é possível graças ao uso de um material especial e partes pré-fabricadas.;The Bee,CNET;Mobilidade Urbana/Smart Cities,Smart City,Impressora 3D
https://www.tecmundo.com.br/produto/204425-novidade-mercado-xzone-busca-porta-entrada-mundo-gamer.htm;Novidade no mercado, XZone busca ser porta de entrada ao mundo gamer;2020-09-28T17:30:01;;0;0;"Mundo afora, o cenário de games penetra em diferentes públicos e exigências. Em uma indústria cada vez mais aquecida, a marca XZone, novata no mercado, nasce com a missão de servir como porta de entrada a esse universo por meio de uma generosa gama de produtos.suporte para apoiar e guardar o headset;microfone ajustável;hastes reguláveis;controle de volume na concha esquerda — é um regulador mecânico, ou seja, independe de software para o ajuste de volume. Ótimo em praticidade.microfone removível;alto-falante com diâmetro de 50 milímetros;isolamento acústico e hastes ajustáveis.4 níveis de DPI ajustáveis;8 botões programáveis;iluminação LED;acabamento emborrachado soft touch, providencial para evitar que o mouse escorregue durante uma jogatina intensa, que ocasionalmente faz o jogador transpirar pelas mãos.6 níveis de DPI ajustáveis;7 botões programáveis;iluminação RGB;9 modos de iluminação LED.7 níveis de DPI ajustáveis;7 botões programáveis e iluminação RGB com 9 modos LED;sensor óptico pixart 3325 para obter mais velocidade e precisão do mouse — excepcional em shooters, a propósito.12 teclas de atalho multimídia;teclas “anti-ghosting”, isto é, garantir o uso de múltiplas teclas ao mesmo tempo sem quaisquer problemas ou imprevistos;iluminação — 7 cores de LED e 3 modos de intensidade.12 teclas de atalho e também “anti-ghosting” para eliminar quaisquer conflitos de comandos;o almejado “Blue Switch Outemu”, que dá ao usuário uma sensação tátil, com cliques audíveis e que respondem em alta performance/precisão;20 modos de iluminação LED com variação de 7 cores;acabamento superior em alumínio.";;Produto,Produtos,Video Game e Jogos
https://www.tecmundo.com.br/mobilidade-urbana-smart-cities/204397-mercedes-lanca-prototipo-eletrico-inspirado-filme-avatar.htm;Mercedes lança protótipo de elétrico inspirado no filme 'Avatar';2020-09-28T17:00:01;Kris Gaiato;0;0;"A Mercedes-Benz divulgou um protótipo de carro elétrico inspirado no filme Avatar, do diretor James Cameron. O modelo, batizado de Vision AVTR, incorpora um aspecto muito relevante do universo fictício: a ideia é que o motorista se una ao automóvel, assim como os personagens do filme fazem ao ""cavalgar"" os banshees, animais voadores que são utilizados como meio de transporte.";Eletrek;Mobilidade Urbana/Smart Cities,Mercedes,Elétricos
https://www.tecmundo.com.br/produto/204422-positivo-casa-inteligente-lanca-lampada-retro-camera-bot-360.htm;Positivo Casa Inteligente lança Lâmpada Retrô e Câmera Bot 360;2020-09-28T16:55:06;Mateus Mognon;0;0;A Positivo Casa Inteligente, divisão da fabricante brasileira focada em Internet das Coisas, lançou recentemente dois novos produtos no nosso país. O catálogo da companhia agora conta com a Câmera Bot 360, voltada para segurança, e também a Lâmpada Smart Retrô.;Positivo Casa Inteligente;Produto,Positivo,Lâmpada
